mysql>SELECT NOW();
+---------------------+
| NOW()               |
+---------------------+
| 2017-08-18 18:33:09 |
+---------------------+
1 row in set (0.00 sec)

mysql>SELECT VERSION();
+------------+
| VERSION()  |
+------------+
| 5.7.17-log |
+------------+
1 row in set (0.00 sec)

mysql>\t
mysql> CREAT DATABASE liuqin
    -> ;
ERROR 1064 (42000): You have an error in your SQL syntax; check the manual that corresponds to your MySQL server version for the right syntax to use near 'CREAT DATABASE liuqin' at line 1
mysql> CREATE DATABASE liuqin1;
Query OK, 1 row affected (0.06 sec)

mysql> CREATE SCHEMA liuqin2;
Query OK, 1 row affected (0.03 sec)

mysql> CREATE SCHEMA liuqin2 IF NOT EXIST;
ERROR 1064 (42000): You have an error in your SQL syntax; check the manual that corresponds to your MySQL server version for the right syntax to use near 'IF NOT EXIST' at line 1
mysql> SHOW WARNING
    -> 
    -> ;
ERROR 1064 (42000): You have an error in your SQL syntax; check the manual that corresponds to your MySQL server version for the right syntax to use near 'WARNING' at line 1
mysql> SHOW WARNINGS;
+-------+------+-----------------------------------------------------------------------------------------------------------------------------------------------------------+
| Level | Code | Message                                                                                                                                                   |
+-------+------+-----------------------------------------------------------------------------------------------------------------------------------------------------------+
| Error | 1064 | You have an error in your SQL syntax; check the manual that corresponds to your MySQL server version for the right syntax to use near 'WARNING' at line 1 |
+-------+------+-----------------------------------------------------------------------------------------------------------------------------------------------------------+
1 row in set (0.00 sec)

mysql> SHOW CREAT DATABASE liuqin1;
ERROR 1064 (42000): You have an error in your SQL syntax; check the manual that corresponds to your MySQL server version for the right syntax to use near 'CREAT DATABASE liuqin1' at line 1
mysql> SHOW CREATE DATABASE liuqin1;
+----------+------------------------------------------------------------------+
| Database | Create Database                                                  |
+----------+------------------------------------------------------------------+
| liuqin1  | CREATE DATABASE `liuqin1` /*!40100 DEFAULT CHARACTER SET utf8 */ |
+----------+------------------------------------------------------------------+
1 row in set (0.00 sec)

mysql> CREATE DATABAS IF NOT EXITS CHARACTER SET GBK
    -> ;
ERROR 1064 (42000): You have an error in your SQL syntax; check the manual that corresponds to your MySQL server version for the right syntax to use near 'DATABAS IF NOT EXITS CHARACTER SET GBK' at line 1
mysql> CREATE DATABASE IF NOT EXITS DEFAULT CHARACTER SET GBK;
ERROR 1064 (42000): You have an error in your SQL syntax; check the manual that corresponds to your MySQL server version for the right syntax to use near 'EXITS DEFAULT CHARACTER SET GBK' at line 1
mysql> CREATE DATABASE IF NOT EXISTS liu CHARACTER SET GBK;
Query OK, 1 row affected (0.04 sec)

mysql> SHOW CREATE DATABASE liu;
+----------+-------------------------------------------------------------+
| Database | Create Database                                             |
+----------+-------------------------------------------------------------+
| liu      | CREATE DATABASE `liu` /*!40100 DEFAULT CHARACTER SET gbk */ |
+----------+-------------------------------------------------------------+
1 row in set (0.00 sec)

mysql> USE liu;
Database changed
mysql> SELECT DATABASE();
+------------+
| DATABASE() |
+------------+
| liu        |
+------------+
1 row in set (0.00 sec)

mysql> DROP DATABASE liu;
Query OK, 0 rows affected (0.03 sec)

mysql> SHOW DATABASES()
    -> ;
ERROR 1064 (42000): You have an error in your SQL syntax; check the manual that corresponds to your MySQL server version for the right syntax to use near '()' at line 1
mysql> SHOW DATABASE();
ERROR 1064 (42000): You have an error in your SQL syntax; check the manual that corresponds to your MySQL server version for the right syntax to use near 'DATABASE()' at line 1
mysql> SHOW DATABASE;
ERROR 1064 (42000): You have an error in your SQL syntax; check the manual that corresponds to your MySQL server version for the right syntax to use near 'DATABASE' at line 1
mysql> SHOW DATABASES;
+--------------------+
| Database           |
+--------------------+
| information_schema |
| liuqin1            |
| liuqin2            |
| mysql              |
| performance_schema |
| sys                |
+--------------------+
6 rows in set (0.03 sec)

mysql> DROP DATABASE liuqin1;
Query OK, 0 rows affected (0.00 sec)

mysql> DROP DATABASE liuqin2;
Query OK, 0 rows affected (0.00 sec)

mysql> help tinyint
Name: 'TINYINT'
Description:
TINYINT[(M)] [UNSIGNED] [ZEROFILL]

A very small integer. The signed range is -128 to 127. The unsigned
range is 0 to 255.

URL: http://dev.mysql.com/doc/refman/5.7/en/numeric-type-overview.html


mysql> help tinyint;
Name: 'TINYINT'
Description:
TINYINT[(M)] [UNSIGNED] [ZEROFILL]

A very small integer. The signed range is -128 to 127. The unsigned
range is 0 to 255.

URL: http://dev.mysql.com/doc/refman/5.7/en/numeric-type-overview.html


mysql> SHOW ENGINES;
+--------------------+---------+----------------------------------------------------------------+--------------+------+------------+
| Engine             | Support | Comment                                                        | Transactions | XA   | Savepoints |
+--------------------+---------+----------------------------------------------------------------+--------------+------+------------+
| InnoDB             | DEFAULT | Supports transactions, row-level locking, and foreign keys     | YES          | YES  | YES        |
| MRG_MYISAM         | YES     | Collection of identical MyISAM tables                          | NO           | NO   | NO         |
| MEMORY             | YES     | Hash based, stored in memory, useful for temporary tables      | NO           | NO   | NO         |
| BLACKHOLE          | YES     | /dev/null storage engine (anything you write to it disappears) | NO           | NO   | NO         |
| MyISAM             | YES     | MyISAM storage engine                                          | NO           | NO   | NO         |
| CSV                | YES     | CSV storage engine                                             | NO           | NO   | NO         |
| ARCHIVE            | YES     | Archive storage engine                                         | NO           | NO   | NO         |
| PERFORMANCE_SCHEMA | YES     | Performance Schema                                             | NO           | NO   | NO         |
| FEDERATED          | NO      | Federated MySQL storage engine                                 | NULL         | NULL | NULL       |
+--------------------+---------+----------------------------------------------------------------+--------------+------+------------+
9 rows in set (0.00 sec)

mysql> SHOW VARIABLES LIKE 'have%';
+------------------------+----------+
| Variable_name          | Value    |
+------------------------+----------+
| have_compress          | YES      |
| have_crypt             | NO       |
| have_dynamic_loading   | YES      |
| have_geometry          | YES      |
| have_openssl           | DISABLED |
| have_profiling         | YES      |
| have_query_cache       | YES      |
| have_rtree_keys        | YES      |
| have_ssl               | DISABLED |
| have_statement_timeout | YES      |
| have_symlink           | YES      |
+------------------------+----------+
11 rows in set, 1 warning (0.01 sec)

mysql> SHOW VARIABLES LIKE 'storage_engine';
Empty set, 1 warning (0.01 sec)

mysql> SHOW DATABASES;
+--------------------+
| Database           |
+--------------------+
| information_schema |
| mysql              |
| performance_schema |
| sys                |
+--------------------+
4 rows in set (0.00 sec)

mysql> --�������ݿ�
    -> CREATE DATABASE IF NOT EXISTS ��mai�� DEFAULT CHARACTER SET 'UTF8';
ERROR 1064 (42000): You have an error in your SQL syntax; check the manual that corresponds to your MySQL server version for the right syntax to use near '--�������ݿ�
CREATE DATABASE IF NOT EXISTS ��mai�� DEFAULT CHARACTER SET ' at line 1
mysql> 
mysql> USE ��mai��;
ERROR 1049 (42000): Unknown database '��mai��'
mysql> 
mysql> --����ѧԱ��user
    -> --����Ҫ��������ʱ����Ҫ��ʱת���ͻ��˵ı��뷽ʽ
    -> CREATE TABLE IF NOT EXISTS ��user����
    -> id SMALLINT,
    -> usename VARCHAR(20),
    -> age TINYINT,
    -> sex ENUM('��'��'Ů','����')��
    -> email VARCHAR(50),
    -> addr VARCHAR(200),
    -> birth YEAR,
    -> salary FLOAT(8,2),
    -> married TINYINT(1) COMMENT '0��δ��'
    -> ��ENGINE=INNODB CHARSET=UTF8;
ERROR 1064 (42000): You have an error in your SQL syntax; check the manual that corresponds to your MySQL server version for the right syntax to use near '--����ѧԱ��user
--����Ҫ��������ʱ����Ҫ��ʱת���ͻ���' at line 1
mysql> CHARACTER SET=gbk;
ERROR 1064 (42000): You have an error in your SQL syntax; check the manual that corresponds to your MySQL server version for the right syntax to use near 'CHARACTER SET=gbk' at line 1
mysql> --�������ݿ�
    -> CREATE DATABASE IF NOT EXISTS ��mai�� DEFAULT CHARACTER SET 'UTF8';
ERROR 1064 (42000): You have an error in your SQL syntax; check the manual that corresponds to your MySQL server version for the right syntax to use near '--�������ݿ�
CREATE DATABASE IF NOT EXISTS ��mai�� DEFAULT CHARACTER SET ' at line 1
mysql> 
mysql> USE ��mai��;
ERROR 1049 (42000): Unknown database '��mai��'
mysql> 
mysql> --����ѧԱ��user
    -> --����Ҫ��������ʱ����Ҫ��ʱת���ͻ��˵ı��뷽ʽ
    -> CREATE TABLE IF NOT EXISTS ��user����
    -> id SMALLINT,
    -> usename VARCHAR(20),
    -> age TINYINT,
    -> sex ENUM('��'��'Ů','����')��
    -> email VARCHAR(50),
    -> addr VARCHAR(200),
    -> birth YEAR,
    -> salary FLOAT(8,2),
    -> married TINYINT(1) COMMENT '0��δ��'
    -> ��ENGINE=INNODB CHARSET=UTF8;
ERROR 1064 (42000): You have an error in your SQL syntax; check the manual that corresponds to your MySQL server version for the right syntax to use near '--����ѧԱ��user
--����Ҫ��������ʱ����Ҫ��ʱת���ͻ���' at line 1
mysql> \S
ERROR: 
Unknown command '\S'.
    -> \s;
--------------

Connection id:		3
Current database:	
Current user:		root@localhost
SSL:			Not in use
Using delimiter:	;
Server version:		5.7.17-log MySQL Community Server (GPL)
Protocol version:	10
Connection:		localhost via TCP/IP
Server characterset:	utf8
Db     characterset:	utf8
Client characterset:	gbk
Conn.  characterset:	gbk
TCP port:		3306
Uptime:			12 hours 39 min 32 sec

Threads: 1  Questions: 46  Slow queries: 0  Opens: 115  Flush tables: 1  Open tables: 108  Queries per second avg: 0.001
--------------

ERROR 1064 (42000): You have an error in your SQL syntax; check the manual that corresponds to your MySQL server version for the right syntax to use near '\S' at line 1
mysql> SET NAMES GEK;
ERROR 1115 (42000): Unknown character set: 'GEK'
mysql> SET NAMES GBK;
Query OK, 0 rows affected (0.00 sec)

mysql> \s;
--------------

Connection id:		3
Current database:	
Current user:		root@localhost
SSL:			Not in use
Using delimiter:	;
Server version:		5.7.17-log MySQL Community Server (GPL)
Protocol version:	10
Connection:		localhost via TCP/IP
Server characterset:	utf8
Db     characterset:	utf8
Client characterset:	gbk
Conn.  characterset:	gbk
TCP port:		3306
Uptime:			12 hours 40 min 22 sec

Threads: 1  Questions: 52  Slow queries: 0  Opens: 115  Flush tables: 1  Open tables: 108  Queries per second avg: 0.001
--------------

ERROR: 
No query specified

mysql> --�������ݿ�
    -> CREATE DATABASE IF NOT EXISTS ��mai�� DEFAULT CHARACTER SET 'UTF8';
ERROR 1064 (42000): You have an error in your SQL syntax; check the manual that corresponds to your MySQL server version for the right syntax to use near '--�������ݿ�
CREATE DATABASE IF NOT EXISTS ��mai�� DEFAULT CHARACTER SET ' at line 1
mysql> 
mysql> USE ��mai��;
ERROR 1049 (42000): Unknown database '��mai��'
mysql> 
mysql> --����ѧԱ��user
    -> --����Ҫ��������ʱ����Ҫ��ʱת���ͻ��˵ı��뷽ʽ
    -> --SET NAMES GBK;
ERROR 1064 (42000): You have an error in your SQL syntax; check the manual that corresponds to your MySQL server version for the right syntax to use near '--����ѧԱ��user
--����Ҫ��������ʱ����Ҫ��ʱת���ͻ���' at line 1
mysql> CREATE TABLE IF NOT EXISTS ��user����
    -> id SMALLINT,
    -> usename VARCHAR(20),
    -> age TINYINT,
    -> sex ENUM('��'��'Ů','����')��
    -> email VARCHAR(50),
    -> addr VARCHAR(200),
    -> birth YEAR,
    -> salary FLOAT(8,2),
    -> married TINYINT(1) COMMENT '0��δ��'
    -> ��ENGINE=INNODB CHARSET=UTF8;
ERROR 1046 (3D000): No database selected
mysql> --�������ݿ�
    -> CREATE DATABASE IF NOT EXISTS ��mai�� DEFAULT CHARACTER SET 'UTF8';
ERROR 1064 (42000): You have an error in your SQL syntax; check the manual that corresponds to your MySQL server version for the right syntax to use near '--�������ݿ�
CREATE DATABASE IF NOT EXISTS ��mai�� DEFAULT CHARACTER SET ' at line 1
mysql> 
mysql> USE ��mai��;
ERROR 1049 (42000): Unknown database '��mai��'
mysql> 
mysql> --����ѧԱ��user
    -> --����Ҫ��������ʱ����Ҫ��ʱת���ͻ��˵ı��뷽ʽ
    -> --SET NAMES GBK;
ERROR 1064 (42000): You have an error in your SQL syntax; check the manual that corresponds to your MySQL server version for the right syntax to use near '--����ѧԱ��user
--����Ҫ��������ʱ����Ҫ��ʱת���ͻ���' at line 1
mysql> CREATE TABLE IF NOT EXISTS ��user����
    -> id SMALLINT,
    -> usename VARCHAR(20),
    -> age TINYINT,
    -> sex ENUM('��'��'Ů','����')��
    -> email VARCHAR(50),
    -> addr VARCHAR(200),
    -> birth YEAR,
    -> salary FLOAT(8,2),
    -> married TINYINT(1) COMMENT '0��δ��'
    -> ��ENGINE=INNODB CHARSET=UTF8;
ERROR 1046 (3D000): No database selected
mysql> SHOW TABLES;
ERROR 1046 (3D000): No database selected
mysql> 
mysql> CREATE DATABASE IF NOT EXISTS ��mai�� DEFAULT CHARACTER SET 'UTF8';
Query OK, 1 row affected (0.01 sec)

mysql> 
mysql> USE ��mai��;
Database changed
mysql> 
mysql> --����ѧԱ��user
    -> --����Ҫ��������ʱ����Ҫ��ʱת���ͻ��˵ı��뷽ʽ
    -> --SET NAMES GBK;
ERROR 1064 (42000): You have an error in your SQL syntax; check the manual that corresponds to your MySQL server version for the right syntax to use near '--����ѧԱ��user
--����Ҫ��������ʱ����Ҫ��ʱת���ͻ���' at line 1
mysql> CREATE TABLE IF NOT EXISTS ��user����
    -> id SMALLINT,
    -> usename VARCHAR(20),
    -> age TINYINT,
    -> sex ENUM('��'��'Ů','����')��
    -> email VARCHAR(50),
    -> addr VARCHAR(200),
    -> birth YEAR,
    -> salary FLOAT(8,2),
    -> married TINYINT(1) COMMENT '0��δ��'
    -> ��ENGINE=INNODB CHARSET=UTF8;
ERROR 1064 (42000): You have an error in your SQL syntax; check the manual that corresponds to your MySQL server version for the right syntax to use near 'id SMALLINT,
usename VARCHAR(20),
age TINYINT,
sex ENUM('��'��'Ů','����')' at line 2
mysql> SET NAMES GBK;
Query OK, 0 rows affected (0.00 sec)

mysql> 
mysql> CREATE DATABASE IF NOT EXISTS ��mai�� DEFAULT CHARACTER SET 'UTF8';
Query OK, 1 row affected, 1 warning (0.00 sec)

mysql> 
mysql> USE ��mai��;
Database changed
mysql> 
mysql> --����ѧԱ��user
    -> --����Ҫ��������ʱ����Ҫ��ʱת���ͻ��˵ı��뷽ʽ
    -> --SET NAMES GBK;
ERROR 1064 (42000): You have an error in your SQL syntax; check the manual that corresponds to your MySQL server version for the right syntax to use near '--����ѧԱ��user
--����Ҫ��������ʱ����Ҫ��ʱת���ͻ���' at line 1
mysql> CREATE TABLE IF NOT EXISTS ��user����
    -> id SMALLINT,
    -> usename VARCHAR(20),
    -> age TINYINT,
    -> sex ENUM('��'��'Ů','����')��
    -> email VARCHAR(50),
    -> addr VARCHAR(200),
    -> birth YEAR,
    -> salary FLOAT(8,2),
    -> married TINYINT(1) COMMENT '0��δ��'
    -> ��ENGINE=INNODB CHARSET=UTF8;
ERROR 1064 (42000): You have an error in your SQL syntax; check the manual that corresponds to your MySQL server version for the right syntax to use near 'id SMALLINT,
usename VARCHAR(20),
age TINYINT,
sex ENUM('��'��'Ů','����')' at line 2
mysql> CREATE DATABASE IF NOT EXISTS cms DEFAULT CHARACTER SET utf8;
Query OK, 1 row affected (0.10 sec)

mysql> USE cms;
Database changed
mysql> -- 管理员表cms_admin
mysql> CREATE TABLE cms_admin(
    -> id TINYINT UNSIGNED AUTO_INCREMENT KEY,
    -> username VARCHAR(20) NOT NULL UNIQUE,
    -> password CHAR(32) NOT NULL,
    -> email VARCHAR(50) NOT NULL DEFAULT 'admin@qq.com',
    -> role ENUM('普通管理员','超级管理员') DEFAULT '普通管理员'
    -> );
Query OK, 0 rows affected (0.50 sec)

mysql> INSERT cms_admin(username,password,email,role) VALUES('admin','admin','admin@qq.com',2);
Query OK, 1 row affected (0.09 sec)

mysql> 
mysql> INSERT cms_admin(username,password) VALUES('king','king'),
    -> 
    -> ('麦子','maizi'),
    -> 
    -> ('queen','queen'),
    -> 
    -> ('test','test');
Query OK, 4 rows affected (0.03 sec)
Records: 4  Duplicates: 0  Warnings: 0

mysql> 
mysql> -- 创建分类表cms_cate
mysql> CREATE TABLE cms_cate(
    -> id TINYINT UNSIGNED AUTO_INCREMENT KEY,
    -> cateName VARCHAR(50) NOT NULL UNIQUE,
    -> cateDesc VARCHAR(200) NOT NULL DEFAULT ''
    -> );
Query OK, 0 rows affected (0.68 sec)

mysql> 
mysql> INSERT cms_cate(cateName,cateDesc) VALUES('国内新闻','聚焦当今最热的国内新闻'),
    -> ('国际新闻','聚焦当今最热的国际新闻'),
    -> ('体育新闻','聚焦当今最热的体育新闻'),
    -> ('军事新闻','聚焦当今最热的军事新闻'),
    -> ('教育新闻','聚焦当今最热的教育新闻');
Query OK, 5 rows affected (0.12 sec)
Records: 5  Duplicates: 0  Warnings: 0

mysql> 
mysql> -- 创建新闻表cms_news
mysql> CREATE TABLE cms_news(
    -> id INT UNSIGNED AUTO_INCREMENT KEY,
    -> title VARCHAR(50) NOT NULL UNIQUE,
    -> content TEXT,
    -> clickNum INT UNSIGNED DEFAULT 0,
    -> pubTime INT UNSIGNED,
    -> cId TINYINT UNSIGNED NOT NULL COMMENT '新闻所属分类，对应分类表中的id',
    -> aId TINYINT UNSIGNED NOT NULL COMMENT '哪个管理员发布的，对应管理员表中的id'
    -> );
Query OK, 0 rows affected (0.21 sec)

mysql> INSERT cms_news(title,content,pubTime,cId,aId) VALUES('亚航客机失联搜救尚无线索 未发求救信号','马来西亚亚洲航空公司一架搭载155名乘客的客机28日早晨从印度尼西亚飞往新加坡途中与空中交通控制塔台失去联系，下落不明。',1419818808,1,2),
    -> ('北京新开通四条地铁线路 迎接首位客人','12月28日凌晨，随着北京地铁6号线二期、7号线、15号线西段、14号线东段的开通试运营，北京的轨道交通运营里程将再添62公里，共计达到527公里。当日凌晨5时许，北京地铁7号线瓷器口换乘站迎来新线开通的第一位乘客。',1419818108,2,1),
    -> ('考研政治题多次出现习近平讲话内容','新京报讯 （记者许路阳 (微博)）APEC反腐宣言、国家公祭日、依法治国……昨日，全国硕士研究生招生考试进行首日初试，其中，思想政治理论考题多次提及时事热点，并且多次出现习近平在不同场合的讲话内容。',1419818208,3,2),
    -> ('深度-曾雪麟：佩兰别重蹈卡马乔覆辙','12月25日是前国足主帅曾雪麟的85岁大寿，恰逢圣诞节，患有尿毒症老爷子带着圣诞帽度过了自己的生日。此前，腾讯记者曾专访曾雪麟，尽管已经退休多年，但老爷子仍旧关心着中国足球，为国足揪心，对于国足近几位的教练，他只欣赏高洪波。对即将征战亚洲杯的国足，老爷子希望佩兰不要重蹈卡马乔的覆辙',1419818308,2,4),
    -> ('国产JAD-1手枪枪架投入使用 手枪可变"冲锋枪"','日前，JAD-1型多功能手枪枪架通过公安部特种警用装备质量监督检验中心检验，正式投入生产使用。此款多功能枪架由京安盾(北京)警用装备有限公司开发研制，期间经广东省江门市公安特警支队试用，获得好评。',1419818408,4,4),
    -> ('麦子学院荣获新浪教育大奖','麦子学院最大的职业IT教育平台，获奖了',1419818508,1,5),
    -> ('麦子学院荣获腾讯教育大奖','麦子学院最大的职业IT教育平台，获奖了',1419818608,1,5),
    -> ('麦子学院新课上线','麦子学院PHP课程马上上线了，小伙伴快来报名学习哈',1419818708,1,5);
Query OK, 8 rows affected (0.04 sec)
Records: 8  Duplicates: 0  Warnings: 0

mysql> 
mysql> -- 创建身份表 provinces
mysql> CREATE TABLE provinces(
    -> id TINYINT UNSIGNED AUTO_INCREMENT KEY,
    -> proName VARCHAR(10) NOT NULL UNIQUE
    -> );
Query OK, 0 rows affected (0.15 sec)

mysql> INSERT provinces(proName) VALUES('北京'),
    -> ('上海'),
    -> ('深圳'),
    -> ('广州'),
    -> ('重庆');
Query OK, 5 rows affected (0.02 sec)
Records: 5  Duplicates: 0  Warnings: 0

mysql> 
mysql> -- 创建用户表cms_user
mysql> CREATE TABLE cms_user(
    -> id INT UNSIGNED AUTO_INCREMENT KEY,
    -> username VARCHAR(20) NOT NULL UNIQUE,
    -> age TINYINT UNSIGNED DEFAULT 18,
    -> password CHAR(32) NOT NULL,
    -> email VARCHAR(50) NOT NULL DEFAULT 'user@qq.com',
    -> regTime INT UNSIGNED NOT NULL,
    -> face VARCHAR(100) NOT NULL DEFAULT 'user.jpg',
    -> proId TINYINT UNSIGNED NOT NULL COMMENT '用户所属省份'
    -> );
Query OK, 0 rows affected (0.17 sec)

mysql> 
mysql> INSERT cms_user(username,password,regTime,proId)
    -> 
    -> VALUES('张三','zhangsan',1419811708,1),
    -> ('张三丰','zhangsanfeng',1419812708,2),
    -> ('章子怡','zhangsan',1419813708,3),
    -> ('long','long',1419814708,4),
    -> ('ring','ring',1419815708,2),
    -> ('queen','queen',1419861708,3),
    -> ('king','king',1419817708,5),
    -> ('blek','blek',1419818708,1),
    -> ('rose','rose',1419821708,2),
    -> ('lily','lily',1419831708,2),
    -> ('john','john',1419841708,2);
Query OK, 11 rows affected (0.01 sec)
Records: 11  Duplicates: 0  Warnings: 0

mysql> UPDATE cms_user SET age=11 WHERE id=1;
Query OK, 1 row affected (0.01 sec)
Rows matched: 1  Changed: 1  Warnings: 0

mysql> UPDATE cms_user SET age=21 WHERE id=2;
Query OK, 1 row affected (0.00 sec)
Rows matched: 1  Changed: 1  Warnings: 0

mysql> UPDATE cms_user SET age=33 WHERE id=3;
Query OK, 1 row affected (0.00 sec)
Rows matched: 1  Changed: 1  Warnings: 0

mysql> UPDATE cms_user SET age=44 WHERE id=4;
Query OK, 1 row affected (0.03 sec)
Rows matched: 1  Changed: 1  Warnings: 0

mysql> UPDATE cms_user SET age=25 WHERE id=5;
Query OK, 1 row affected (0.00 sec)
Rows matched: 1  Changed: 1  Warnings: 0

mysql> UPDATE cms_user SET age=77 WHERE id=6;
Query OK, 1 row affected (0.00 sec)
Rows matched: 1  Changed: 1  Warnings: 0

mysql> UPDATE cms_user SET age=56 WHERE id=7;
Query OK, 1 row affected (0.03 sec)
Rows matched: 1  Changed: 1  Warnings: 0

mysql> UPDATE cms_user SET age=88 WHERE id=8;
Query OK, 1 row affected (0.02 sec)
Rows matched: 1  Changed: 1  Warnings: 0

mysql> UPDATE cms_user SET age=12 WHERE id=9;
Query OK, 1 row affected (0.00 sec)
Rows matched: 1  Changed: 1  Warnings: 0

mysql> UPDATE cms_user SET age=32 WHERE id=10;
Query OK, 1 row affected (0.00 sec)
Rows matched: 1  Changed: 1  Warnings: 0

mysql> UPDATE cms_user SET age=65 WHERE id=11;
Query OK, 1 row affected (0.00 sec)
Rows matched: 1  Changed: 1  Warnings: 0

mysql> SELECT * FROM cms_user;
+----+-----------+------+--------------+-------------+------------+----------+-------+
| id | username  | age  | password     | email       | regTime    | face     | proId |
+----+-----------+------+--------------+-------------+------------+----------+-------+
|  1 | 张三      |   11 | zhangsan     | user@qq.com | 1419811708 | user.jpg |     1 |
|  2 | 张三丰    |   21 | zhangsanfeng | user@qq.com | 1419812708 | user.jpg |     2 |
|  3 | 章子怡    |   33 | zhangsan     | user@qq.com | 1419813708 | user.jpg |     3 |
|  4 | long      |   44 | long         | user@qq.com | 1419814708 | user.jpg |     4 |
|  5 | ring      |   25 | ring         | user@qq.com | 1419815708 | user.jpg |     2 |
|  6 | queen     |   77 | queen        | user@qq.com | 1419861708 | user.jpg |     3 |
|  7 | king      |   56 | king         | user@qq.com | 1419817708 | user.jpg |     5 |
|  8 | blek      |   88 | blek         | user@qq.com | 1419818708 | user.jpg |     1 |
|  9 | rose      |   12 | rose         | user@qq.com | 1419821708 | user.jpg |     2 |
| 10 | lily      |   32 | lily         | user@qq.com | 1419831708 | user.jpg |     2 |
| 11 | john      |   65 | john         | user@qq.com | 1419841708 | user.jpg |     2 |
+----+-----------+------+--------------+-------------+------------+----------+-------+
11 rows in set (0.00 sec)

mysql> SELECT sex,GROUP_CONCAT(username) AS users,
    -> COUNT(*) AS totalUsers,
    -> MAX(age) AS max_age,
    -> SUM(age) AS sum_age
    -> FROM cms_user 
    -> GROUP BY sex;
ERROR 1054 (42S22): Unknown column 'sex' in 'field list'
mysql> ALTER cms_user ADD sex VARCHAR(50) NOT NULL DEFAULT 'male';
ERROR 1064 (42000): You have an error in your SQL syntax; check the manual that corresponds to your MySQL server version for the right syntax to use near 'cms_user ADD sex VARCHAR(50) NOT NULL DEFAULT 'male'' at line 1
mysql> ALTER cms_user ADD sex VARCHAR(50) NOT NULL DEFAULT 'male' TO cms_user;
ERROR 1064 (42000): You have an error in your SQL syntax; check the manual that corresponds to your MySQL server version for the right syntax to use near 'cms_user ADD sex VARCHAR(50) NOT NULL DEFAULT 'male' TO cms_user' at line 1
mysql> ALTER TABLE cms_user ADD sex VARCHAR(50) NOT NULL DEFAULT 'male';
Query OK, 0 rows affected (0.53 sec)
Records: 0  Duplicates: 0  Warnings: 0

mysql> SELECT sex,GROUP_CONCAT(username) AS users,
    -> COUNT(*) AS totalUsers,
    -> MAX(age) AS max_age,
    -> SUM(age) AS sum_age
    -> FROM cms_user 
    -> GROUP BY sex;
+------+---------------------------------------------------------------------+------------+---------+---------+
| sex  | users                                                               | totalUsers | max_age | sum_age |
+------+---------------------------------------------------------------------+------------+---------+---------+
| male | 张三,张三丰,章子怡,long,ring,queen,king,blek,rose,lily,john         |         11 |      88 |     464 |
+------+---------------------------------------------------------------------+------------+---------+---------+
1 row in set (0.11 sec)

mysql> SHOW * FROM cms_user;
ERROR 1064 (42000): You have an error in your SQL syntax; check the manual that corresponds to your MySQL server version for the right syntax to use near '* FROM cms_user' at line 1
mysql> SELECT * FROM cms_user;
+----+-----------+------+--------------+-------------+------------+----------+-------+------+
| id | username  | age  | password     | email       | regTime    | face     | proId | sex  |
+----+-----------+------+--------------+-------------+------------+----------+-------+------+
|  1 | 张三      |   11 | zhangsan     | user@qq.com | 1419811708 | user.jpg |     1 | male |
|  2 | 张三丰    |   21 | zhangsanfeng | user@qq.com | 1419812708 | user.jpg |     2 | male |
|  3 | 章子怡    |   33 | zhangsan     | user@qq.com | 1419813708 | user.jpg |     3 | male |
|  4 | long      |   44 | long         | user@qq.com | 1419814708 | user.jpg |     4 | male |
|  5 | ring      |   25 | ring         | user@qq.com | 1419815708 | user.jpg |     2 | male |
|  6 | queen     |   77 | queen        | user@qq.com | 1419861708 | user.jpg |     3 | male |
|  7 | king      |   56 | king         | user@qq.com | 1419817708 | user.jpg |     5 | male |
|  8 | blek      |   88 | blek         | user@qq.com | 1419818708 | user.jpg |     1 | male |
|  9 | rose      |   12 | rose         | user@qq.com | 1419821708 | user.jpg |     2 | male |
| 10 | lily      |   32 | lily         | user@qq.com | 1419831708 | user.jpg |     2 | male |
| 11 | john      |   65 | john         | user@qq.com | 1419841708 | user.jpg |     2 | male |
+----+-----------+------+--------------+-------------+------------+----------+-------+------+
11 rows in set (0.00 sec)

mysql> SELECT sex,GROUP_CONCAT(username) AS users,
    -> COUNT(*) AS totalUsers,
    -> MAX(age) AS max_age,
    -> SUM(age) AS sum_age
    -> FROM cms_user 
    -> GROUP BY sex
    -> HAVING COUNT(*)>2;
+------+---------------------------------------------------------------------+------------+---------+---------+
| sex  | users                                                               | totalUsers | max_age | sum_age |
+------+---------------------------------------------------------------------+------------+---------+---------+
| male | 张三,张三丰,章子怡,long,ring,queen,king,blek,rose,lily,john         |         11 |      88 |     464 |
+------+---------------------------------------------------------------------+------------+---------+---------+
1 row in set (0.00 sec)

mysql> SELECT sex,GROUP_CONCAT(username) AS users,
    -> COUNT(*) AS totalUsers,
    -> MAX(age) AS max_age,
    -> SUM(age) AS sum_age
    -> FROM cms_user 
    -> GROUP BY sex
    -> HAVING COUNT(*)>2 AND MAX(age)>60;
+------+---------------------------------------------------------------------+------------+---------+---------+
| sex  | users                                                               | totalUsers | max_age | sum_age |
+------+---------------------------------------------------------------------+------------+---------+---------+
| male | 张三,张三丰,章子怡,long,ring,queen,king,blek,rose,lily,john         |         11 |      88 |     464 |
+------+---------------------------------------------------------------------+------------+---------+---------+
1 row in set (0.02 sec)

mysql> SELECT sex,GROUP_CONCAT(username) AS users,
    -> COUNT(*) AS totalUsers,
    -> MAX(age) AS max_age,
    -> SUM(age) AS sum_age
    -> FROM cms_user 
    -> WHERE id>=2
    -> GROUP BY sex
    -> HAVING COUNT(*)>2 AND MAX(age)>60;
+------+--------------------------------------------------------------+------------+---------+---------+
| sex  | users                                                        | totalUsers | max_age | sum_age |
+------+--------------------------------------------------------------+------------+---------+---------+
| male | 张三丰,章子怡,long,ring,queen,king,blek,rose,lily,john       |         10 |      88 |     453 |
+------+--------------------------------------------------------------+------------+---------+---------+
1 row in set (0.01 sec)

mysql> SELECT * FROM cms_user ORDER BY age ASC;
+----+-----------+------+--------------+-------------+------------+----------+-------+------+
| id | username  | age  | password     | email       | regTime    | face     | proId | sex  |
+----+-----------+------+--------------+-------------+------------+----------+-------+------+
|  1 | 张三      |   11 | zhangsan     | user@qq.com | 1419811708 | user.jpg |     1 | male |
|  9 | rose      |   12 | rose         | user@qq.com | 1419821708 | user.jpg |     2 | male |
|  2 | 张三丰    |   21 | zhangsanfeng | user@qq.com | 1419812708 | user.jpg |     2 | male |
|  5 | ring      |   25 | ring         | user@qq.com | 1419815708 | user.jpg |     2 | male |
| 10 | lily      |   32 | lily         | user@qq.com | 1419831708 | user.jpg |     2 | male |
|  3 | 章子怡    |   33 | zhangsan     | user@qq.com | 1419813708 | user.jpg |     3 | male |
|  4 | long      |   44 | long         | user@qq.com | 1419814708 | user.jpg |     4 | male |
|  7 | king      |   56 | king         | user@qq.com | 1419817708 | user.jpg |     5 | male |
| 11 | john      |   65 | john         | user@qq.com | 1419841708 | user.jpg |     2 | male |
|  6 | queen     |   77 | queen        | user@qq.com | 1419861708 | user.jpg |     3 | male |
|  8 | blek      |   88 | blek         | user@qq.com | 1419818708 | user.jpg |     1 | male |
+----+-----------+------+--------------+-------------+------------+----------+-------+------+
11 rows in set (0.00 sec)

mysql> SELECT * FROM cms_user ORDER BY age ASC,id DESC;
+----+-----------+------+--------------+-------------+------------+----------+-------+------+
| id | username  | age  | password     | email       | regTime    | face     | proId | sex  |
+----+-----------+------+--------------+-------------+------------+----------+-------+------+
|  1 | 张三      |   11 | zhangsan     | user@qq.com | 1419811708 | user.jpg |     1 | male |
|  9 | rose      |   12 | rose         | user@qq.com | 1419821708 | user.jpg |     2 | male |
|  2 | 张三丰    |   21 | zhangsanfeng | user@qq.com | 1419812708 | user.jpg |     2 | male |
|  5 | ring      |   25 | ring         | user@qq.com | 1419815708 | user.jpg |     2 | male |
| 10 | lily      |   32 | lily         | user@qq.com | 1419831708 | user.jpg |     2 | male |
|  3 | 章子怡    |   33 | zhangsan     | user@qq.com | 1419813708 | user.jpg |     3 | male |
|  4 | long      |   44 | long         | user@qq.com | 1419814708 | user.jpg |     4 | male |
|  7 | king      |   56 | king         | user@qq.com | 1419817708 | user.jpg |     5 | male |
| 11 | john      |   65 | john         | user@qq.com | 1419841708 | user.jpg |     2 | male |
|  6 | queen     |   77 | queen        | user@qq.com | 1419861708 | user.jpg |     3 | male |
|  8 | blek      |   88 | blek         | user@qq.com | 1419818708 | user.jpg |     1 | male |
+----+-----------+------+--------------+-------------+------------+----------+-------+------+
11 rows in set (0.00 sec)

mysql> SELECT id,age,sex,GROUP_CONCAT(username),COUNT(*) AS totalUsers,SUM(age) AS sum_age 
    -> FROM cms_user 
    -> WHERE id>=2 
    -> GROUP BY sex
    -> HAVING COUNT(*)>=2
    -> ORDER BY age DESC,id ASC;
+----+------+------+--------------------------------------------------------------+------------+---------+
| id | age  | sex  | GROUP_CONCAT(username)                                       | totalUsers | sum_age |
+----+------+------+--------------------------------------------------------------+------------+---------+
|  2 |   21 | male | 张三丰,章子怡,long,ring,queen,king,blek,rose,lily,john       |         10 |     453 |
+----+------+------+--------------------------------------------------------------+------------+---------+
1 row in set (0.06 sec)

mysql> SELECT * FROM cms_user ORDER BY RAND();
+----+-----------+------+--------------+-------------+------------+----------+-------+------+
| id | username  | age  | password     | email       | regTime    | face     | proId | sex  |
+----+-----------+------+--------------+-------------+------------+----------+-------+------+
|  2 | 张三丰    |   21 | zhangsanfeng | user@qq.com | 1419812708 | user.jpg |     2 | male |
|  5 | ring      |   25 | ring         | user@qq.com | 1419815708 | user.jpg |     2 | male |
|  8 | blek      |   88 | blek         | user@qq.com | 1419818708 | user.jpg |     1 | male |
| 11 | john      |   65 | john         | user@qq.com | 1419841708 | user.jpg |     2 | male |
|  9 | rose      |   12 | rose         | user@qq.com | 1419821708 | user.jpg |     2 | male |
|  6 | queen     |   77 | queen        | user@qq.com | 1419861708 | user.jpg |     3 | male |
|  7 | king      |   56 | king         | user@qq.com | 1419817708 | user.jpg |     5 | male |
| 10 | lily      |   32 | lily         | user@qq.com | 1419831708 | user.jpg |     2 | male |
|  1 | 张三      |   11 | zhangsan     | user@qq.com | 1419811708 | user.jpg |     1 | male |
|  3 | 章子怡    |   33 | zhangsan     | user@qq.com | 1419813708 | user.jpg |     3 | male |
|  4 | long      |   44 | long         | user@qq.com | 1419814708 | user.jpg |     4 | male |
+----+-----------+------+--------------+-------------+------------+----------+-------+------+
11 rows in set (0.14 sec)

mysql> SELECT * FROM cms_user LIMIT 3;
+----+-----------+------+--------------+-------------+------------+----------+-------+------+
| id | username  | age  | password     | email       | regTime    | face     | proId | sex  |
+----+-----------+------+--------------+-------------+------------+----------+-------+------+
|  1 | 张三      |   11 | zhangsan     | user@qq.com | 1419811708 | user.jpg |     1 | male |
|  2 | 张三丰    |   21 | zhangsanfeng | user@qq.com | 1419812708 | user.jpg |     2 | male |
|  3 | 章子怡    |   33 | zhangsan     | user@qq.com | 1419813708 | user.jpg |     3 | male |
+----+-----------+------+--------------+-------------+------------+----------+-------+------+
3 rows in set (0.00 sec)

mysql> SELECT * FROM cms_user LIMIT 0,1;
+----+----------+------+----------+-------------+------------+----------+-------+------+
| id | username | age  | password | email       | regTime    | face     | proId | sex  |
+----+----------+------+----------+-------------+------------+----------+-------+------+
|  1 | 张三     |   11 | zhangsan | user@qq.com | 1419811708 | user.jpg |     1 | male |
+----+----------+------+----------+-------------+------------+----------+-------+------+
1 row in set (0.00 sec)

mysql> SELECT * FROM cms_user LIMIT 0,5;
+----+-----------+------+--------------+-------------+------------+----------+-------+------+
| id | username  | age  | password     | email       | regTime    | face     | proId | sex  |
+----+-----------+------+--------------+-------------+------------+----------+-------+------+
|  1 | 张三      |   11 | zhangsan     | user@qq.com | 1419811708 | user.jpg |     1 | male |
|  2 | 张三丰    |   21 | zhangsanfeng | user@qq.com | 1419812708 | user.jpg |     2 | male |
|  3 | 章子怡    |   33 | zhangsan     | user@qq.com | 1419813708 | user.jpg |     3 | male |
|  4 | long      |   44 | long         | user@qq.com | 1419814708 | user.jpg |     4 | male |
|  5 | ring      |   25 | ring         | user@qq.com | 1419815708 | user.jpg |     2 | male |
+----+-----------+------+--------------+-------------+------------+----------+-------+------+
5 rows in set (0.00 sec)

mysql> SELECT * FROM cms_user LIMIT 2,5;
+----+-----------+------+----------+-------------+------------+----------+-------+------+
| id | username  | age  | password | email       | regTime    | face     | proId | sex  |
+----+-----------+------+----------+-------------+------------+----------+-------+------+
|  3 | 章子怡    |   33 | zhangsan | user@qq.com | 1419813708 | user.jpg |     3 | male |
|  4 | long      |   44 | long     | user@qq.com | 1419814708 | user.jpg |     4 | male |
|  5 | ring      |   25 | ring     | user@qq.com | 1419815708 | user.jpg |     2 | male |
|  6 | queen     |   77 | queen    | user@qq.com | 1419861708 | user.jpg |     3 | male |
|  7 | king      |   56 | king     | user@qq.com | 1419817708 | user.jpg |     5 | male |
+----+-----------+------+----------+-------------+------------+----------+-------+------+
5 rows in set (0.00 sec)

mysql> SELECT id,sex,age,GROUP_CONCAT(username),
    -> COUNT(*) AS totalUsers,
    -> MAX(age) AS max_age,
    -> MIN(age) AS min_age,
    -> AVG(age) AS avg_age,
    -> SUM(age) AS sum_age
    -> FROM cms_user
    -> WHERE id>=1
    -> GROUP BY sex
    -> HAVING COUNT(*)>=2
    -> ORDER BY age DESC
    -> LIMIT 0,2;
+----+------+------+---------------------------------------------------------------------+------------+---------+---------+---------+---------+
| id | sex  | age  | GROUP_CONCAT(username)                                              | totalUsers | max_age | min_age | avg_age | sum_age |
+----+------+------+---------------------------------------------------------------------+------------+---------+---------+---------+---------+
|  1 | male |   11 | 张三,张三丰,章子怡,long,ring,queen,king,blek,rose,lily,john         |         11 |      88 |      11 | 42.1818 |     464 |
+----+------+------+---------------------------------------------------------------------+------------+---------+---------+---------+---------+
1 row in set (0.08 sec)

mysql> UPDATE cms_user SET age=age-3 WHERE username LIKE '____';
Query OK, 7 rows affected (0.06 sec)
Rows matched: 7  Changed: 7  Warnings: 0

mysql> UPDATE cms_user SET age=age-10 LIMIT 3;
Query OK, 3 rows affected (0.02 sec)
Rows matched: 3  Changed: 3  Warnings: 0

mysql> UPDATE cms_user SET age=age+10 ORDER BY DESC LIMIT 3;
ERROR 1064 (42000): You have an error in your SQL syntax; check the manual that corresponds to your MySQL server version for the right syntax to use near 'DESC LIMIT 3' at line 1
mysql> UPDATE cms_user SET age=age+10 ORDER BY id DESC LIMIT 3;
Query OK, 3 rows affected (0.00 sec)
Rows matched: 3  Changed: 3  Warnings: 0

mysql> SELECT cms_user.id,username,proName FROM cms_user,provinces;
+----+-----------+---------+
| id | username  | proName |
+----+-----------+---------+
|  8 | blek      | 上海    |
|  8 | blek      | 北京    |
|  8 | blek      | 广州    |
|  8 | blek      | 深圳    |
|  8 | blek      | 重庆    |
| 11 | john      | 上海    |
| 11 | john      | 北京    |
| 11 | john      | 广州    |
| 11 | john      | 深圳    |
| 11 | john      | 重庆    |
|  7 | king      | 上海    |
|  7 | king      | 北京    |
|  7 | king      | 广州    |
|  7 | king      | 深圳    |
|  7 | king      | 重庆    |
| 10 | lily      | 上海    |
| 10 | lily      | 北京    |
| 10 | lily      | 广州    |
| 10 | lily      | 深圳    |
| 10 | lily      | 重庆    |
|  4 | long      | 上海    |
|  4 | long      | 北京    |
|  4 | long      | 广州    |
|  4 | long      | 深圳    |
|  4 | long      | 重庆    |
|  6 | queen     | 上海    |
|  6 | queen     | 北京    |
|  6 | queen     | 广州    |
|  6 | queen     | 深圳    |
|  6 | queen     | 重庆    |
|  5 | ring      | 上海    |
|  5 | ring      | 北京    |
|  5 | ring      | 广州    |
|  5 | ring      | 深圳    |
|  5 | ring      | 重庆    |
|  9 | rose      | 上海    |
|  9 | rose      | 北京    |
|  9 | rose      | 广州    |
|  9 | rose      | 深圳    |
|  9 | rose      | 重庆    |
|  1 | 张三      | 上海    |
|  1 | 张三      | 北京    |
|  1 | 张三      | 广州    |
|  1 | 张三      | 深圳    |
|  1 | 张三      | 重庆    |
|  2 | 张三丰    | 上海    |
|  2 | 张三丰    | 北京    |
|  2 | 张三丰    | 广州    |
|  2 | 张三丰    | 深圳    |
|  2 | 张三丰    | 重庆    |
|  3 | 章子怡    | 上海    |
|  3 | 章子怡    | 北京    |
|  3 | 章子怡    | 广州    |
|  3 | 章子怡    | 深圳    |
|  3 | 章子怡    | 重庆    |
+----+-----------+---------+
55 rows in set (1.44 sec)

mysql> 
mysql> SELECT cms_user.id,username,proName FROM cms_user,provinces
    -> WHERE cms_user.proId=provinces.id;
+----+-----------+---------+
| id | username  | proName |
+----+-----------+---------+
|  1 | 张三      | 北京    |
|  2 | 张三丰    | 上海    |
|  3 | 章子怡    | 深圳    |
|  4 | long      | 广州    |
|  5 | ring      | 上海    |
|  6 | queen     | 深圳    |
|  7 | king      | 重庆    |
|  8 | blek      | 北京    |
|  9 | rose      | 上海    |
| 10 | lily      | 上海    |
| 11 | john      | 上海    |
+----+-----------+---------+
11 rows in set (0.05 sec)

mysql> SELECT u.id,u.username,u.email,u.sex,p.proName
    -> FROM cms_user AS u
    -> INNER JOIN provinces AS p
    -> ON u.proId=p.id;
+----+-----------+-------------+------+---------+
| id | username  | email       | sex  | proName |
+----+-----------+-------------+------+---------+
|  1 | 张三      | user@qq.com | male | 北京    |
|  2 | 张三丰    | user@qq.com | male | 上海    |
|  3 | 章子怡    | user@qq.com | male | 深圳    |
|  4 | long      | user@qq.com | male | 广州    |
|  5 | ring      | user@qq.com | male | 上海    |
|  6 | queen     | user@qq.com | male | 深圳    |
|  7 | king      | user@qq.com | male | 重庆    |
|  8 | blek      | user@qq.com | male | 北京    |
|  9 | rose      | user@qq.com | male | 上海    |
| 10 | lily      | user@qq.com | male | 上海    |
| 11 | john      | user@qq.com | male | 上海    |
+----+-----------+-------------+------+---------+
11 rows in set (0.00 sec)

mysql> SELECT u.id,u.username,u.email,u.sex,p.proName
    -> FROM provinces AS p
    -> CROSS JOIN cms_user AS u
    -> ON u.proId=p.id;
+----+-----------+-------------+------+---------+
| id | username  | email       | sex  | proName |
+----+-----------+-------------+------+---------+
|  1 | 张三      | user@qq.com | male | 北京    |
|  2 | 张三丰    | user@qq.com | male | 上海    |
|  3 | 章子怡    | user@qq.com | male | 深圳    |
|  4 | long      | user@qq.com | male | 广州    |
|  5 | ring      | user@qq.com | male | 上海    |
|  6 | queen     | user@qq.com | male | 深圳    |
|  7 | king      | user@qq.com | male | 重庆    |
|  8 | blek      | user@qq.com | male | 北京    |
|  9 | rose      | user@qq.com | male | 上海    |
| 10 | lily      | user@qq.com | male | 上海    |
| 11 | john      | user@qq.com | male | 上海    |
+----+-----------+-------------+------+---------+
11 rows in set (0.00 sec)

mysql> SELECT u.id,u.username,u.email,u.sex,p.proName
    -> FROM cms_user AS u
    -> JOIN provinces AS p
    -> ON u.proId=p.id
    -> WHERE u.sex='male';
+----+-----------+-------------+------+---------+
| id | username  | email       | sex  | proName |
+----+-----------+-------------+------+---------+
|  1 | 张三      | user@qq.com | male | 北京    |
|  2 | 张三丰    | user@qq.com | male | 上海    |
|  3 | 章子怡    | user@qq.com | male | 深圳    |
|  4 | long      | user@qq.com | male | 广州    |
|  5 | ring      | user@qq.com | male | 上海    |
|  6 | queen     | user@qq.com | male | 深圳    |
|  7 | king      | user@qq.com | male | 重庆    |
|  8 | blek      | user@qq.com | male | 北京    |
|  9 | rose      | user@qq.com | male | 上海    |
| 10 | lily      | user@qq.com | male | 上海    |
| 11 | john      | user@qq.com | male | 上海    |
+----+-----------+-------------+------+---------+
11 rows in set (0.00 sec)

mysql> GROUP BY p.proName;
ERROR 1064 (42000): You have an error in your SQL syntax; check the manual that corresponds to your MySQL server version for the right syntax to use near 'GROUP BY p.proName' at line 1
mysql> SELECT u.id,u.username,u.email,u.sex,p.proName
    -> FROM cms_user AS u
    -> JOIN provinces AS p
    -> ON u.proId=p.id
    -> WHERE u.sex='male'
    -> GROUP BY p.proName;
+----+-----------+-------------+------+---------+
| id | username  | email       | sex  | proName |
+----+-----------+-------------+------+---------+
|  2 | 张三丰    | user@qq.com | male | 上海    |
|  1 | 张三      | user@qq.com | male | 北京    |
|  4 | long      | user@qq.com | male | 广州    |
|  3 | 章子怡    | user@qq.com | male | 深圳    |
|  7 | king      | user@qq.com | male | 重庆    |
+----+-----------+-------------+------+---------+
5 rows in set (0.09 sec)

mysql> SELECT u.id,u.username,u.email,u.sex,p.proName,COUNT(*) AS TOTAL
    -> FROM cms_user AS u
    -> JOIN provinces AS p
    -> ON u.proId=p.id
    -> WHERE u.sex='male'
    -> GROUP BY p.proName;
+----+-----------+-------------+------+---------+-------+
| id | username  | email       | sex  | proName | TOTAL |
+----+-----------+-------------+------+---------+-------+
|  2 | 张三丰    | user@qq.com | male | 上海    |     5 |
|  1 | 张三      | user@qq.com | male | 北京    |     2 |
|  4 | long      | user@qq.com | male | 广州    |     1 |
|  3 | 章子怡    | user@qq.com | male | 深圳    |     2 |
|  7 | king      | user@qq.com | male | 重庆    |     1 |
+----+-----------+-------------+------+---------+-------+
5 rows in set (0.01 sec)

mysql> SELECT u.id,u.username,u.email,u.sex,p.proName,COUNT(*) AS TOTAL,GROUP_CONCAT(username)
    -> FROM cms_user AS u
    -> JOIN provinces AS p
    -> ON u.proId=p.id
    -> WHERE u.sex='male'
    -> GROUP BY p.proName;
+----+----------+-------------+------+---------+-------+-------------------------------+
| id | username | email       | sex  | proName | TOTAL | GROUP_CONCAT(username)        |
+----+----------+-------------+------+---------+-------+-------------------------------+
| 11 | john     | user@qq.com | male | 上海    |     5 | john,ring,lily,rose,张三丰    |
|  1 | 张三     | user@qq.com | male | 北京    |     2 | 张三,blek                     |
|  4 | long     | user@qq.com | male | 广州    |     1 | long                          |
|  6 | queen    | user@qq.com | male | 深圳    |     2 | queen,章子怡                  |
|  7 | king     | user@qq.com | male | 重庆    |     1 | king                          |
+----+----------+-------------+------+---------+-------+-------------------------------+
5 rows in set (0.04 sec)

mysql> SELECT u.id,u.username,u.email,u.sex,p.proName,COUNT(*) AS TOTAL,GROUP_CONCAT(username)
    -> FROM cms_user AS u
    -> JOIN provinces AS p
    -> ON u.proId=p.id
    -> WHERE u.sex='male'
    -> GROUP BY p.proName
    -> HAVING COUNT(*)>=1;
+----+----------+-------------+------+---------+-------+-------------------------------+
| id | username | email       | sex  | proName | TOTAL | GROUP_CONCAT(username)        |
+----+----------+-------------+------+---------+-------+-------------------------------+
| 11 | john     | user@qq.com | male | 上海    |     5 | john,ring,lily,rose,张三丰    |
|  1 | 张三     | user@qq.com | male | 北京    |     2 | 张三,blek                     |
|  4 | long     | user@qq.com | male | 广州    |     1 | long                          |
|  6 | queen    | user@qq.com | male | 深圳    |     2 | queen,章子怡                  |
|  7 | king     | user@qq.com | male | 重庆    |     1 | king                          |
+----+----------+-------------+------+---------+-------+-------------------------------+
5 rows in set (0.00 sec)

mysql> SELECT u.id,u.username,u.email,u.sex,p.proName,COUNT(*) AS TOTAL,GROUP_CONCAT(username)
    -> FROM cms_user AS u
    -> JOIN provinces AS p
    -> ON u.proId=p.id
    -> WHERE u.sex='male'
    -> GROUP BY p.proName
    -> HAVING COUNT(*)>=3;
+----+----------+-------------+------+---------+-------+-------------------------------+
| id | username | email       | sex  | proName | TOTAL | GROUP_CONCAT(username)        |
+----+----------+-------------+------+---------+-------+-------------------------------+
| 11 | john     | user@qq.com | male | 上海    |     5 | john,ring,lily,rose,张三丰    |
+----+----------+-------------+------+---------+-------+-------------------------------+
1 row in set (0.00 sec)

mysql> SELECT u.id,u.username,u.email,u.sex,p.proName,COUNT(*) AS TOTAL,GROUP_CONCAT(username)
    -> FROM cms_user AS u
    -> JOIN provinces AS p
    -> ON u.proId=p.id
    -> WHERE u.sex='male'
    -> GROUP BY p.proName
    -> HAVING COUNT(*)>=3
    -> ORDER BY u.id ASC;
+----+----------+-------------+------+---------+-------+-------------------------------+
| id | username | email       | sex  | proName | TOTAL | GROUP_CONCAT(username)        |
+----+----------+-------------+------+---------+-------+-------------------------------+
| 11 | john     | user@qq.com | male | 上海    |     5 | john,ring,lily,rose,张三丰    |
+----+----------+-------------+------+---------+-------+-------------------------------+
1 row in set (0.11 sec)

mysql> SELECT n.id,n.title
    -> FROM cms_news AS n
    -> JOIN cms_cate AS c
    -> ON n.cId=c.id
    -> ;
+----+-------------------------------------------------------------+
| id | title                                                       |
+----+-------------------------------------------------------------+
|  1 | 亚航客机失联搜救尚无线索 未发求救信号                       |
|  2 | 北京新开通四条地铁线路 迎接首位客人                         |
|  3 | 考研政治题多次出现习近平讲话内容                            |
|  4 | 深度-曾雪麟：佩兰别重蹈卡马乔覆辙                           |
|  5 | 国产JAD-1手枪枪架投入使用 手枪可变"冲锋枪"                  |
|  6 | 麦子学院荣获新浪教育大奖                                    |
|  7 | 麦子学院荣获腾讯教育大奖                                    |
|  8 | 麦子学院新课上线                                            |
+----+-------------------------------------------------------------+
8 rows in set (0.16 sec)

mysql> SELECT n.id,n.title,a.username,a.role
    -> FROM cms_news AS n
    -> JOIN cms_admin AS a
    -> ON n.aId=a.id;
+----+-------------------------------------------------------------+----------+-----------------+
| id | title                                                       | username | role            |
+----+-------------------------------------------------------------+----------+-----------------+
|  1 | 亚航客机失联搜救尚无线索 未发求救信号                       | king     | 普通管理员      |
|  2 | 北京新开通四条地铁线路 迎接首位客人                         | admin    | 超级管理员      |
|  3 | 考研政治题多次出现习近平讲话内容                            | king     | 普通管理员      |
|  4 | 深度-曾雪麟：佩兰别重蹈卡马乔覆辙                           | queen    | 普通管理员      |
|  5 | 国产JAD-1手枪枪架投入使用 手枪可变"冲锋枪"                  | queen    | 普通管理员      |
|  6 | 麦子学院荣获新浪教育大奖                                    | test     | 普通管理员      |
|  7 | 麦子学院荣获腾讯教育大奖                                    | test     | 普通管理员      |
|  8 | 麦子学院新课上线                                            | test     | 普通管理员      |
+----+-------------------------------------------------------------+----------+-----------------+
8 rows in set (0.07 sec)

mysql> SELECT n.id,n.title,a.username,a.role,c.cateName
    -> FROM cms_cate AS c
    -> JOIN cms_news AS n
    -> ON n.cId=c.id
    -> JOIN cms_admin AS a
    -> ON n.aId=a.id;
+----+-------------------------------------------------------------+----------+-----------------+--------------+
| id | title                                                       | username | role            | cateName     |
+----+-------------------------------------------------------------+----------+-----------------+--------------+
|  1 | 亚航客机失联搜救尚无线索 未发求救信号                       | king     | 普通管理员      | 国内新闻     |
|  2 | 北京新开通四条地铁线路 迎接首位客人                         | admin    | 超级管理员      | 国际新闻     |
|  3 | 考研政治题多次出现习近平讲话内容                            | king     | 普通管理员      | 体育新闻     |
|  4 | 深度-曾雪麟：佩兰别重蹈卡马乔覆辙                           | queen    | 普通管理员      | 国际新闻     |
|  5 | 国产JAD-1手枪枪架投入使用 手枪可变"冲锋枪"                  | queen    | 普通管理员      | 军事新闻     |
|  6 | 麦子学院荣获新浪教育大奖                                    | test     | 普通管理员      | 国内新闻     |
|  7 | 麦子学院荣获腾讯教育大奖                                    | test     | 普通管理员      | 国内新闻     |
|  8 | 麦子学院新课上线                                            | test     | 普通管理员      | 国内新闻     |
+----+-------------------------------------------------------------+----------+-----------------+--------------+
8 rows in set (0.00 sec)

mysql> SHOW TABLES;
+---------------+
| Tables_in_cms |
+---------------+
| cms_admin     |
| cms_cate      |
| cms_news      |
| cms_user      |
| provinces     |
+---------------+
5 rows in set (0.00 sec)

mysql> INSERT cms_user(username,password,regTime,proId)
    -> VALUES('TEST1','TEST1','1235648566',20)
    -> ;
Query OK, 1 row affected (0.15 sec)

mysql> SELECT u.id,u.username,u.email,u.sex,p.proName
    -> FROM provinces AS p
    -> LEFT JOIN cms_user AS u
    -> ON u.proId=p.id;
+------+-----------+-------------+------+---------+
| id   | username  | email       | sex  | proName |
+------+-----------+-------------+------+---------+
|    1 | 张三      | user@qq.com | male | 北京    |
|    2 | 张三丰    | user@qq.com | male | 上海    |
|    3 | 章子怡    | user@qq.com | male | 深圳    |
|    4 | long      | user@qq.com | male | 广州    |
|    5 | ring      | user@qq.com | male | 上海    |
|    6 | queen     | user@qq.com | male | 深圳    |
|    7 | king      | user@qq.com | male | 重庆    |
|    8 | blek      | user@qq.com | male | 北京    |
|    9 | rose      | user@qq.com | male | 上海    |
|   10 | lily      | user@qq.com | male | 上海    |
|   11 | john      | user@qq.com | male | 上海    |
+------+-----------+-------------+------+---------+
11 rows in set (0.01 sec)

mysql> SELECT u.id,u.username,u.email,u.sex,p.proName
    -> FROM provinces AS p
    -> RIGHT JOIN cms_user AS u
    -> ON u.proId=p.id;
+----+-----------+-------------+------+---------+
| id | username  | email       | sex  | proName |
+----+-----------+-------------+------+---------+
|  1 | 张三      | user@qq.com | male | 北京    |
|  2 | 张三丰    | user@qq.com | male | 上海    |
|  3 | 章子怡    | user@qq.com | male | 深圳    |
|  4 | long      | user@qq.com | male | 广州    |
|  5 | ring      | user@qq.com | male | 上海    |
|  6 | queen     | user@qq.com | male | 深圳    |
|  7 | king      | user@qq.com | male | 重庆    |
|  8 | blek      | user@qq.com | male | 北京    |
|  9 | rose      | user@qq.com | male | 上海    |
| 10 | lily      | user@qq.com | male | 上海    |
| 11 | john      | user@qq.com | male | 上海    |
| 12 | TEST1     | user@qq.com | male | NULL    |
+----+-----------+-------------+------+---------+
12 rows in set (0.00 sec)

mysql> CREATE TABLE IF NOT EXISTS department(
    -> id TINYINT UNSIGNED AUTO_INCREMENT KEY,
    -> depName VARCHAR(20) NOT NULL UNIQUE
    -> )ENGINE=INNODB;
Query OK, 0 rows affected (0.45 sec)

mysql> 
mysql> INSERT department(depName) VALUES('教学部')，
    -> ('市场部')，
    -> ('运营部')，
    -> ('督导部');
ERROR 1064 (42000): You have an error in your SQL syntax; check the manual that corresponds to your MySQL server version for the right syntax to use near '，
('市场部')，
('运营部')，
('督导部')' at line 1
mysql> INSERT department(depName) VALUES('教学部'),
    -> ('市场部'),
    -> ('运营部'),
    -> ('督导部');
Query OK, 4 rows affected (0.05 sec)
Records: 4  Duplicates: 0  Warnings: 0

mysql> show tables;
+---------------+
| Tables_in_cms |
+---------------+
| cms_admin     |
| cms_cate      |
| cms_news      |
| cms_user      |
| department    |
| provinces     |
+---------------+
6 rows in set (0.00 sec)

mysql> DESC department;
+---------+---------------------+------+-----+---------+----------------+
| Field   | Type                | Null | Key | Default | Extra          |
+---------+---------------------+------+-----+---------+----------------+
| id      | tinyint(3) unsigned | NO   | PRI | NULL    | auto_increment |
| depName | varchar(20)         | NO   | UNI | NULL    |                |
+---------+---------------------+------+-----+---------+----------------+
2 rows in set (0.08 sec)

mysql> INSERT employee(username,depId) VALUES('liu',1),
    -> ('liu',2),
    -> ('liu',3),
    -> ('liu',4),
    -> ('liu',1);
ERROR 1146 (42S02): Table 'cms.employee' doesn't exist
mysql> CREATE TABLE IF NOT EXISTS employee(
    -> id TINYINT UNSIGNED AUTO_INCREMENT KEY,
    -> username VARCHAR(20) NOT NULL UNIQUE,
    -> depId TINYINT UNSIGNED
    -> )ENGINE=INNODB;
Query OK, 0 rows affected (0.28 sec)

mysql> 
mysql> INSERT employee(username,depId) VALUES('liu',1),
    -> ('liu',2),
    -> ('liu',3),
    -> ('liu',4),
    -> ('liu',1);
ERROR 1062 (23000): Duplicate entry 'liu' for key 'username'
mysql> INSERT employee(username,depId) VALUES('liu',1),
    -> ('liu',2),
    -> ('liu',3),
    -> ('liu',4),
    -> ('liu',1);
ERROR 1062 (23000): Duplicate entry 'liu' for key 'username'
mysql> INSERT employee(username,depId) VALUES('liuqin',1),
    -> ('liu',2),
    -> ('liu',3),
    -> ('liu',4),
    -> ('liu',1);
ERROR 1062 (23000): Duplicate entry 'liu' for key 'username'
mysql> INSERT employee(username,depId) VALUES('liuqin',1),
    -> ('liu1',2),
    -> ('liu2',3),
    -> ('liu3',4),
    -> ('liu4',1);
Query OK, 5 rows affected (0.07 sec)
Records: 5  Duplicates: 0  Warnings: 0

mysql> SELECT e.id,e.username,d.depName FROM
    -> employee AS e
    -> JOIN
    -> department AS d
    -> ON e.depId=d.id;
+----+----------+-----------+
| id | username | depName   |
+----+----------+-----------+
| 16 | liuqin   | 教学部    |
| 17 | liu1     | 市场部    |
| 18 | liu2     | 运营部    |
| 19 | liu3     | 督导部    |
| 20 | liu4     | 教学部    |
+----+----------+-----------+
5 rows in set (0.00 sec)

mysql> CREATE TABLE IF NOT EXISTS employee(
    -> id TINYINT UNSIGNED AUTO_INCREMENT KEY,
    -> username VARCHAR(20) NOT NULL UNIQUE,
    -> depId TINYINT UNSIGNED
    -> FOREIGN KEY(depId) REFERENCES department(id)
    -> )ENGINE=INNODB;
ERROR 1064 (42000): You have an error in your SQL syntax; check the manual that corresponds to your MySQL server version for the right syntax to use near 'FOREIGN KEY(depId) REFERENCES department(id)
)ENGINE=INNODB' at line 5
mysql> 
mysql> INSERT employee(username,depId) VALUES('liuqin',1),
    -> ('liu1',2),
    -> ('liu2',3),
    -> ('liu3',4),
    -> ('liu4',1);
ERROR 1062 (23000): Duplicate entry 'liuqin' for key 'username'
mysql> DELETE FROM employee;
Query OK, 3 rows affected (0.00 sec)

mysql> UPDATE department SET id=id+10;
Query OK, 3 rows affected (0.06 sec)
Rows matched: 3  Changed: 3  Warnings: 0

mysql> SELECT * FROM employee;
Empty set (0.00 sec)

mysql> SELECT * FROM department;
+----+-----------+
| id | depName   |
+----+-----------+
| 12 | 市场部    |
| 14 | 督导部    |
| 13 | 运营部    |
+----+-----------+
3 rows in set (0.00 sec)

mysql> SELECT username FROM employee UNION SELECT username FROM cms_user;
+-----------+
| username  |
+-----------+
| blek      |
| john      |
| king      |
| lily      |
| long      |
| queen     |
| ring      |
| rose      |
| TEST1     |
| 张三      |
| 张三丰    |
| 章子怡    |
+-----------+
12 rows in set (0.29 sec)

mysql> SELECT username FROM employee;
Empty set (0.00 sec)

mysql> CREATE TABLE IF NOT EXISTS employee(
    -> id TINYINT UNSIGNED AUTO_INCREMENT KEY,
    -> username VARCHAR(20) NOT NULL UNIQUE,
    -> depId TINYINT UNSIGNED,
    -> FOREIGN KEY(depId) REFERENCES department(id) ON DELETE CASCADE ON UPDATE CASCADE
    -> --删除后变成NULL, FOREIGN KEY(depId) REFERENCES department(id) ON DELETE SET NULL ON UPDATE SET NULL
    -> )ENGINE=INNODB;
ERROR 1064 (42000): You have an error in your SQL syntax; check the manual that corresponds to your MySQL server version for the right syntax to use near '--删除后变成NULL, FOREIGN KEY(depId) REFERENCES department(id) ON DELETE SE' at line 6
mysql> 
mysql> INSERT employee(username,depId) VALUES('liuqin',1),
    -> ('liu1',2),
    -> ('liu2',3),
    -> ('liu3',4),
    -> ('liu4',1);
ERROR 1452 (23000): Cannot add or update a child row: a foreign key constraint fails (`cms`.`employee`, CONSTRAINT `employee_ibfk_1` FOREIGN KEY (`depId`) REFERENCES `department` (`id`) ON DELETE CASCADE)
mysql> ALTER TABLE employee DROP FOREIGN KEY emp_fk_dep;
ERROR 1091 (42000): Can't DROP 'emp_fk_dep'; check that column/key exists
mysql> 
mysql> ALTER TABLE employee DROP FOREIGN KEY depId;
ERROR 1091 (42000): Can't DROP 'depId'; check that column/key exists
mysql> ALTER TABLE employee ADD CONSTRAINT emp_fk_dep FOREIGN KEY(depId) REFERENCES department(id);
Query OK, 0 rows affected (0.80 sec)
Records: 0  Duplicates: 0  Warnings: 0

mysql> ALTER TABLE employee DROP FOREIGN KEY emp_fk_dep;
Query OK, 0 rows affected (0.07 sec)
Records: 0  Duplicates: 0  Warnings: 0

mysql> INSERT employee(username,depId) VALUES('liuqin',1),
    -> ('liu1',2),
    -> ('liu2',3),
    -> ('liu3',4),
    -> ('liu4',1);
ERROR 1452 (23000): Cannot add or update a child row: a foreign key constraint fails (`cms`.`employee`, CONSTRAINT `employee_ibfk_1` FOREIGN KEY (`depId`) REFERENCES `department` (`id`) ON DELETE CASCADE)
mysql> DROP TABLE employee;
Query OK, 0 rows affected (0.07 sec)

mysql> CREATE TABLE IF NOT EXISTS employee(
    -> id TINYINT UNSIGNED AUTO_INCREMENT KEY,
    -> username VARCHAR(20) NOT NULL UNIQUE,
    -> depId TINYINT UNSIGNED,
    -> --FOREIGN KEY(depId) REFERENCES department(id) ON DELETE CASCADE ON UPDATE CASCADE
    -> --删除后变成NULL, FOREIGN KEY(depId) REFERENCES department(id) ON DELETE SET NULL ON UPDATE SET NULL
    -> )ENGINE=INNODB;
ERROR 1064 (42000): You have an error in your SQL syntax; check the manual that corresponds to your MySQL server version for the right syntax to use near '--FOREIGN KEY(depId) REFERENCES department(id) ON DELETE CASCADE ON UPDATE CASCA' at line 5
mysql> 
mysql> INSERT employee(username,depId) VALUES('liuqin',1),
    -> ('liu1',2),
    -> ('liu2',3),
    -> ('liu3',4),
    -> ('liu4',1);
ERROR 1146 (42S02): Table 'cms.employee' doesn't exist
mysql> CREATE TABLE IF NOT EXISTS employee(
    -> id TINYINT UNSIGNED AUTO_INCREMENT KEY,
    -> username VARCHAR(20) NOT NULL UNIQUE,
    -> depId TINYINT UNSIGNED
    -> --FOREIGN KEY(depId) REFERENCES department(id) ON DELETE CASCADE ON UPDATE CASCADE
    -> --删除后变成NULL, FOREIGN KEY(depId) REFERENCES department(id) ON DELETE SET NULL ON UPDATE SET NULL
    -> )ENGINE=INNODB;
ERROR 1064 (42000): You have an error in your SQL syntax; check the manual that corresponds to your MySQL server version for the right syntax to use near '--FOREIGN KEY(depId) REFERENCES department(id) ON DELETE CASCADE ON UPDATE CASCA' at line 5
mysql> 
mysql> INSERT employee(username,depId) VALUES('liuqin',1),
    -> ('liu1',2),
    -> ('liu2',3),
    -> ('liu3',4),
    -> ('liu4',1);
ERROR 1146 (42S02): Table 'cms.employee' doesn't exist
mysql> CREATE TABLE IF NOT EXISTS employee(
    -> id TINYINT UNSIGNED AUTO_INCREMENT KEY,
    -> username VARCHAR(20) NOT NULL UNIQUE,
    -> depId TINYINT UNSIGNED
    -> --FOREIGN KEY(depId) REFERENCES department(id) ON DELETE CASCADE ON UPDATE CASCADE
    -> --删除后变成NULL, FOREIGN KEY(depId) REFERENCES department(id) ON DELETE SET NULL ON UPDATE SET NULL
    -> )ENGINE=INNODB;
ERROR 1064 (42000): You have an error in your SQL syntax; check the manual that corresponds to your MySQL server version for the right syntax to use near '--FOREIGN KEY(depId) REFERENCES department(id) ON DELETE CASCADE ON UPDATE CASCA' at line 5
mysql> 
mysql> INSERT employee(username,depId) VALUES('liuqin',1),
    -> ('liu1',2),
    -> ('liu2',3),
    -> ('liu3',4),
    -> ('liu4',1);
ERROR 1146 (42S02): Table 'cms.employee' doesn't exist
mysql> CREATE TABLE IF NOT EXISTS employee(
    -> id TINYINT UNSIGNED AUTO_INCREMENT KEY,
    -> username VARCHAR(20) NOT NULL UNIQUE,
    -> depId TINYINT UNSIGNED
    -> -- FOREIGN KEY(depId) REFERENCES department(id) ON DELETE CASCADE ON UPDATE CASCADE
    -> -- 删除后变成NULL, FOREIGN KEY(depId) REFERENCES department(id) ON DELETE SET NULL ON UPDATE SET NULL
    -> )ENGINE=INNODB;
Query OK, 0 rows affected (0.15 sec)

mysql> 
mysql> INSERT employee(username,depId) VALUES('liuqin',1),
    -> ('liu1',2),
    -> ('liu2',3),
    -> ('liu3',4),
    -> ('liu4',1);
Query OK, 5 rows affected (0.04 sec)
Records: 5  Duplicates: 0  Warnings: 0

mysql> SELECT username FROM employee UNION SELECT username FROM cms_user;
+-----------+
| username  |
+-----------+
| liu1      |
| liu2      |
| liu3      |
| liu4      |
| liuqin    |
| blek      |
| john      |
| king      |
| lily      |
| long      |
| queen     |
| ring      |
| rose      |
| TEST1     |
| 张三      |
| 张三丰    |
| 章子怡    |
+-----------+
17 rows in set (0.00 sec)

mysql> SELECT username FROM employee UNION ALL SELECT username FROM cms_user;
+-----------+
| username  |
+-----------+
| liu1      |
| liu2      |
| liu3      |
| liu4      |
| liuqin    |
| blek      |
| john      |
| king      |
| lily      |
| long      |
| queen     |
| ring      |
| rose      |
| TEST1     |
| 张三      |
| 张三丰    |
| 章子怡    |
+-----------+
17 rows in set (0.00 sec)

mysql> DROP TALE department,employee;
ERROR 1064 (42000): You have an error in your SQL syntax; check the manual that corresponds to your MySQL server version for the right syntax to use near 'TALE department,employee' at line 1
mysql> DROP TABLE department,employee;
Query OK, 0 rows affected (0.17 sec)

mysql> CREATE TABLE IF NOT EXISTS department(
    -> id TINYINT UNSIGNED AUTO_INCREMENT KEY,
    -> depName VARCHAR(20) NOT NULL UNIQUE
    -> )ENGINE=INNODB;
Query OK, 0 rows affected (0.07 sec)

mysql> INSERT department(depName) VALUES('教学部'),
    -> ('市场部'),
    -> ('运营部'),
    -> ('督导部');
Query OK, 4 rows affected (0.02 sec)
Records: 4  Duplicates: 0  Warnings: 0

mysql> 
mysql> CREATE TABLE IF NOT EXISTS employee(
    -> id TINYINT UNSIGNED AUTO_INCREMENT KEY,
    -> username VARCHAR(20) NOT NULL UNIQUE,
    -> depId TINYINT UNSIGNED
    -> )ENGINE=INNODB;
Query OK, 0 rows affected (0.16 sec)

mysql> INSERT employee(username,depId) VALUES('liuqin',1),
    -> ('liu1',2),
    -> ('liu2',3),
    -> ('liu3',4),
    -> ('liu4',1);
Query OK, 5 rows affected (0.05 sec)
Records: 5  Duplicates: 0  Warnings: 0

mysql> SELECT * FROM department;
+----+-----------+
| id | depName   |
+----+-----------+
|  2 | 市场部    |
|  1 | 教学部    |
|  4 | 督导部    |
|  3 | 运营部    |
+----+-----------+
4 rows in set (0.00 sec)

mysql> SELECT id,username FROM employee WHERE depId IN(SELECT id FROM department);
+----+----------+
| id | username |
+----+----------+
|  1 | liuqin   |
|  2 | liu1     |
|  3 | liu2     |
|  4 | liu3     |
|  5 | liu4     |
+----+----------+
5 rows in set (0.10 sec)

mysql> CREATE TABLE IF NOT EXISTS student(
    -> id TINYINT UNSIGNED AUTO_INCREMENT KEY,
    -> username VARCHAR(20) NOT NULL UNIQUE,
    -> score TINYINT UNSIGNED
    -> );
Query OK, 0 rows affected (0.06 sec)

mysql> INSERT student(username,score) VALUES('liu1',99),
    -> ('liu2',99),
    -> ('liu3',80),
    -> ('liu4',70),
    -> ('liu5',60),
    -> ('liu6',53),
    -> ('liu7',80),
    -> ('liu7',77),
    -> 
    -> -- 创建奖学金表
    -> CREATE TABLE IF NOT EXISTS scholarship(
    -> id TINYINT UNSIGNED AUTO_INCREMENT KEY,
    -> level TINYINT UNSIGNED,
    -> );
ERROR 1064 (42000): You have an error in your SQL syntax; check the manual that corresponds to your MySQL server version for the right syntax to use near 'CREATE TABLE IF NOT EXISTS scholarship(
id TINYINT UNSIGNED AUTO_INCREMENT KEY,
' at line 11
mysql> INSERT scholarship(level) VALUES(90),(80),(70);
ERROR 1146 (42S02): Table 'cms.scholarship' doesn't exist
mysql> INSERT student(username,score) VALUES('liu1',99),
    -> ('liu2',99),
    -> ('liu3',80),
    -> ('liu4',70),
    -> ('liu5',60),
    -> ('liu6',53),
    -> ('liu7',80),
    -> ('liu7',77),
    -> 
    -> -- 创建奖学金表
    -> CREATE TABLE IF NOT EXISTS scholarship(
    -> id TINYINT UNSIGNED AUTO_INCREMENT KEY,
    -> level TINYINT UNSIGNED
    -> );
ERROR 1064 (42000): You have an error in your SQL syntax; check the manual that corresponds to your MySQL server version for the right syntax to use near 'CREATE TABLE IF NOT EXISTS scholarship(
id TINYINT UNSIGNED AUTO_INCREMENT KEY,
' at line 11
mysql> INSERT scholarship(level) VALUES(90),(80),(70);
ERROR 1146 (42S02): Table 'cms.scholarship' doesn't exist
mysql> 
mysql> CREATE TABLE IF NOT EXISTS student(
    -> id TINYINT UNSIGNED AUTO_INCREMENT KEY,
    -> username VARCHAR(20) NOT NULL UNIQUE,
    -> score TINYINT UNSIGNED
    -> );
Query OK, 0 rows affected, 1 warning (0.01 sec)

mysql> INSERT student(username,score) VALUES('liu1',99),
    -> ('liu2',99),
    -> ('liu3',80),
    -> ('liu4',70),
    -> ('liu5',60),
    -> ('liu6',53),
    -> ('liu7',80),
    -> ('liu7',77);
ERROR 1062 (23000): Duplicate entry 'liu7' for key 'username'
mysql> 
mysql> -- 创建奖学金表
mysql> CREATE TABLE IF NOT EXISTS scholarship(
    -> id TINYINT UNSIGNED AUTO_INCREMENT KEY,
    -> level TINYINT UNSIGNED
    -> );
Query OK, 0 rows affected (0.13 sec)

mysql> INSERT scholarship(level) VALUES(90),(80),(70);
Query OK, 3 rows affected (0.01 sec)
Records: 3  Duplicates: 0  Warnings: 0

mysql> SELECT id,username FROM student WHERE score>=(SELECT level FROM scholarship WHERE id=1);
Empty set (0.01 sec)

mysql> INSERT student(username,score) VALUES('liu1',99),
    -> ('liu2',99),
    -> ('liu3',80),
    -> ('liu4',70),
    -> ('liu5',60),
    -> ('liu6',53),
    -> ('liu7',80),
    -> ('liu8',77);
Query OK, 8 rows affected (0.01 sec)
Records: 8  Duplicates: 0  Warnings: 0

mysql> SELECT id,username FROM student WHERE score>=(SELECT level FROM scholarship WHERE id=1);
+----+----------+
| id | username |
+----+----------+
|  9 | liu1     |
| 10 | liu2     |
+----+----------+
2 rows in set (0.00 sec)

mysql> SELECT id,username FROM student WHERE score>=(SELECT level FROM scholarship);
ERROR 1242 (21000): Subquery returns more than 1 row
mysql> SELECT id,username,score FROM student WHERE score>=(SELECT level FROM scholarship);
ERROR 1242 (21000): Subquery returns more than 1 row
mysql> SELECT id,username,score FROM student WHERE score>=ANY(SELECT level FROM scholarship);
+----+----------+-------+
| id | username | score |
+----+----------+-------+
|  9 | liu1     |    99 |
| 10 | liu2     |    99 |
| 11 | liu3     |    80 |
| 12 | liu4     |    70 |
| 15 | liu7     |    80 |
| 16 | liu8     |    77 |
+----+----------+-------+
6 rows in set (0.06 sec)

mysql> SELECT id,username,score FROM student WHERE score>=ALL(SELECT level FROM scholarship);
+----+----------+-------+
| id | username | score |
+----+----------+-------+
|  9 | liu1     |    99 |
| 10 | liu2     |    99 |
+----+----------+-------+
2 rows in set (0.00 sec)

mysql> SELECT id,username,score FROM student WHERE score<ALL(SELECT level FROM scholarship);
+----+----------+-------+
| id | username | score |
+----+----------+-------+
| 13 | liu5     |    60 |
| 14 | liu6     |    53 |
+----+----------+-------+
2 rows in set (0.00 sec)

mysql> SELECT id,username,score FROM student WHERE score=ANY(SELECT level FROM scholarship);
+----+----------+-------+
| id | username | score |
+----+----------+-------+
| 11 | liu3     |    80 |
| 12 | liu4     |    70 |
| 15 | liu7     |    80 |
+----+----------+-------+
3 rows in set (0.04 sec)

mysql> SELECT id,username,score FROM student WHERE score<>ALL(SELECT level FROM scholarship);
+----+----------+-------+
| id | username | score |
+----+----------+-------+
|  9 | liu1     |    99 |
| 10 | liu2     |    99 |
| 13 | liu5     |    60 |
| 14 | liu6     |    53 |
| 16 | liu8     |    77 |
+----+----------+-------+
5 rows in set (0.06 sec)

mysql> SELECT * FROM cms_user WHERE username REGEXP '.';
+----+-----------+------+--------------+-------------+------------+----------+-------+------+
| id | username  | age  | password     | email       | regTime    | face     | proId | sex  |
+----+-----------+------+--------------+-------------+------------+----------+-------+------+
|  1 | 张三      |    1 | zhangsan     | user@qq.com | 1419811708 | user.jpg |     1 | male |
|  2 | 张三丰    |   11 | zhangsanfeng | user@qq.com | 1419812708 | user.jpg |     2 | male |
|  3 | 章子怡    |   23 | zhangsan     | user@qq.com | 1419813708 | user.jpg |     3 | male |
|  4 | long      |   41 | long         | user@qq.com | 1419814708 | user.jpg |     4 | male |
|  5 | ring      |   22 | ring         | user@qq.com | 1419815708 | user.jpg |     2 | male |
|  6 | queen     |   77 | queen        | user@qq.com | 1419861708 | user.jpg |     3 | male |
|  7 | king      |   53 | king         | user@qq.com | 1419817708 | user.jpg |     5 | male |
|  8 | blek      |   85 | blek         | user@qq.com | 1419818708 | user.jpg |     1 | male |
|  9 | rose      |   19 | rose         | user@qq.com | 1419821708 | user.jpg |     2 | male |
| 10 | lily      |   39 | lily         | user@qq.com | 1419831708 | user.jpg |     2 | male |
| 11 | john      |   72 | john         | user@qq.com | 1419841708 | user.jpg |     2 | male |
| 12 | TEST1     |   18 | TEST1        | user@qq.com | 1235648566 | user.jpg |    20 | male |
+----+-----------+------+--------------+-------------+------------+----------+-------+------+
12 rows in set (0.05 sec)

mysql> SELECT * FROM cms_user WHERE username REGEXP 'R..G';
+----+----------+------+----------+-------------+------------+----------+-------+------+
| id | username | age  | password | email       | regTime    | face     | proId | sex  |
+----+----------+------+----------+-------------+------------+----------+-------+------+
|  5 | ring     |   22 | ring     | user@qq.com | 1419815708 | user.jpg |     2 | male |
+----+----------+------+----------+-------------+------------+----------+-------+------+
1 row in set (0.00 sec)

mysql> SELECT * FROM cms_user WHERE username REGEXP '[lto]';
+----+----------+------+----------+-------------+------------+----------+-------+------+
| id | username | age  | password | email       | regTime    | face     | proId | sex  |
+----+----------+------+----------+-------------+------------+----------+-------+------+
|  4 | long     |   41 | long     | user@qq.com | 1419814708 | user.jpg |     4 | male |
|  8 | blek     |   85 | blek     | user@qq.com | 1419818708 | user.jpg |     1 | male |
|  9 | rose     |   19 | rose     | user@qq.com | 1419821708 | user.jpg |     2 | male |
| 10 | lily     |   39 | lily     | user@qq.com | 1419831708 | user.jpg |     2 | male |
| 11 | john     |   72 | john     | user@qq.com | 1419841708 | user.jpg |     2 | male |
| 12 | TEST1    |   18 | TEST1    | user@qq.com | 1235648566 | user.jpg |    20 | male |
+----+----------+------+----------+-------------+------------+----------+-------+------+
6 rows in set (0.00 sec)

mysql> SELECT * FROM cms_user WHERE username REGEXP '[^lto]';
+----+-----------+------+--------------+-------------+------------+----------+-------+------+
| id | username  | age  | password     | email       | regTime    | face     | proId | sex  |
+----+-----------+------+--------------+-------------+------------+----------+-------+------+
|  1 | 张三      |    1 | zhangsan     | user@qq.com | 1419811708 | user.jpg |     1 | male |
|  2 | 张三丰    |   11 | zhangsanfeng | user@qq.com | 1419812708 | user.jpg |     2 | male |
|  3 | 章子怡    |   23 | zhangsan     | user@qq.com | 1419813708 | user.jpg |     3 | male |
|  4 | long      |   41 | long         | user@qq.com | 1419814708 | user.jpg |     4 | male |
|  5 | ring      |   22 | ring         | user@qq.com | 1419815708 | user.jpg |     2 | male |
|  6 | queen     |   77 | queen        | user@qq.com | 1419861708 | user.jpg |     3 | male |
|  7 | king      |   53 | king         | user@qq.com | 1419817708 | user.jpg |     5 | male |
|  8 | blek      |   85 | blek         | user@qq.com | 1419818708 | user.jpg |     1 | male |
|  9 | rose      |   19 | rose         | user@qq.com | 1419821708 | user.jpg |     2 | male |
| 10 | lily      |   39 | lily         | user@qq.com | 1419831708 | user.jpg |     2 | male |
| 11 | john      |   72 | john         | user@qq.com | 1419841708 | user.jpg |     2 | male |
| 12 | TEST1     |   18 | TEST1        | user@qq.com | 1235648566 | user.jpg |    20 | male |
+----+-----------+------+--------------+-------------+------------+----------+-------+------+
12 rows in set (0.00 sec)

mysql> SELECT * FROM cms_user WHERE username REGEXP 'ng|qu';
+----+----------+------+----------+-------------+------------+----------+-------+------+
| id | username | age  | password | email       | regTime    | face     | proId | sex  |
+----+----------+------+----------+-------------+------------+----------+-------+------+
|  4 | long     |   41 | long     | user@qq.com | 1419814708 | user.jpg |     4 | male |
|  5 | ring     |   22 | ring     | user@qq.com | 1419815708 | user.jpg |     2 | male |
|  6 | queen    |   77 | queen    | user@qq.com | 1419861708 | user.jpg |     3 | male |
|  7 | king     |   53 | king     | user@qq.com | 1419817708 | user.jpg |     5 | male |
+----+----------+------+----------+-------------+------------+----------+-------+------+
4 rows in set (0.00 sec)

mysql> SELECT * FROM cms_user WHERE username REGEXP 'que*';
+----+----------+------+----------+-------------+------------+----------+-------+------+
| id | username | age  | password | email       | regTime    | face     | proId | sex  |
+----+----------+------+----------+-------------+------------+----------+-------+------+
|  6 | queen    |   77 | queen    | user@qq.com | 1419861708 | user.jpg |     3 | male |
+----+----------+------+----------+-------------+------------+----------+-------+------+
1 row in set (0.00 sec)

mysql> SELECT * FROM cms_user WHERE username REGEXP 'e*';
+----+-----------+------+--------------+-------------+------------+----------+-------+------+
| id | username  | age  | password     | email       | regTime    | face     | proId | sex  |
+----+-----------+------+--------------+-------------+------------+----------+-------+------+
|  1 | 张三      |    1 | zhangsan     | user@qq.com | 1419811708 | user.jpg |     1 | male |
|  2 | 张三丰    |   11 | zhangsanfeng | user@qq.com | 1419812708 | user.jpg |     2 | male |
|  3 | 章子怡    |   23 | zhangsan     | user@qq.com | 1419813708 | user.jpg |     3 | male |
|  4 | long      |   41 | long         | user@qq.com | 1419814708 | user.jpg |     4 | male |
|  5 | ring      |   22 | ring         | user@qq.com | 1419815708 | user.jpg |     2 | male |
|  6 | queen     |   77 | queen        | user@qq.com | 1419861708 | user.jpg |     3 | male |
|  7 | king      |   53 | king         | user@qq.com | 1419817708 | user.jpg |     5 | male |
|  8 | blek      |   85 | blek         | user@qq.com | 1419818708 | user.jpg |     1 | male |
|  9 | rose      |   19 | rose         | user@qq.com | 1419821708 | user.jpg |     2 | male |
| 10 | lily      |   39 | lily         | user@qq.com | 1419831708 | user.jpg |     2 | male |
| 11 | john      |   72 | john         | user@qq.com | 1419841708 | user.jpg |     2 | male |
| 12 | TEST1     |   18 | TEST1        | user@qq.com | 1235648566 | user.jpg |    20 | male |
+----+-----------+------+--------------+-------------+------------+----------+-------+------+
12 rows in set (0.00 sec)

mysql> SELECT * FROM cms_user WHERE username REGEXP 'e+';-- 一次或者多次
+----+----------+------+----------+-------------+------------+----------+-------+------+
| id | username | age  | password | email       | regTime    | face     | proId | sex  |
+----+----------+------+----------+-------------+------------+----------+-------+------+
|  6 | queen    |   77 | queen    | user@qq.com | 1419861708 | user.jpg |     3 | male |
|  8 | blek     |   85 | blek     | user@qq.com | 1419818708 | user.jpg |     1 | male |
|  9 | rose     |   19 | rose     | user@qq.com | 1419821708 | user.jpg |     2 | male |
| 12 | TEST1    |   18 | TEST1    | user@qq.com | 1235648566 | user.jpg |    20 | male |
+----+----------+------+----------+-------------+------------+----------+-------+------+
4 rows in set (0.00 sec)

mysql> SELECT * FROM cms_user WHERE username REGEXP 'que{2}';
+----+----------+------+----------+-------------+------------+----------+-------+------+
| id | username | age  | password | email       | regTime    | face     | proId | sex  |
+----+----------+------+----------+-------------+------------+----------+-------+------+
|  6 | queen    |   77 | queen    | user@qq.com | 1419861708 | user.jpg |     3 | male |
+----+----------+------+----------+-------------+------------+----------+-------+------+
1 row in set (0.00 sec)

mysql> SELECT 1+2;
+-----+
| 1+2 |
+-----+
|   3 |
+-----+
1 row in set (0.00 sec)

mysql> SELECT 3 DIV 8;
+---------+
| 3 DIV 8 |
+---------+
|       0 |
+---------+
1 row in set (0.06 sec)

mysql> SELECT 4 DIV 2;
+---------+
| 4 DIV 2 |
+---------+
|       2 |
+---------+
1 row in set (0.00 sec)

mysql> SELECT 1=2;
+-----+
| 1=2 |
+-----+
|   0 |
+-----+
1 row in set (0.00 sec)

mysql> SELECT id,username,age IS NULL FROM cms_user;
+----+-----------+-------------+
| id | username  | age IS NULL |
+----+-----------+-------------+
|  1 | 张三      |           0 |
|  2 | 张三丰    |           0 |
|  3 | 章子怡    |           0 |
|  4 | long      |           0 |
|  5 | ring      |           0 |
|  6 | queen     |           0 |
|  7 | king      |           0 |
|  8 | blek      |           0 |
|  9 | rose      |           0 |
| 10 | lily      |           0 |
| 11 | john      |           0 |
| 12 | TEST1     |           0 |
+----+-----------+-------------+
12 rows in set (0.00 sec)

mysql> SELECT id,username,age IS NOT NULL FROM cms_user;
+----+-----------+-----------------+
| id | username  | age IS NOT NULL |
+----+-----------+-----------------+
|  1 | 张三      |               1 |
|  2 | 张三丰    |               1 |
|  3 | 章子怡    |               1 |
|  4 | long      |               1 |
|  5 | ring      |               1 |
|  6 | queen     |               1 |
|  7 | king      |               1 |
|  8 | blek      |               1 |
|  9 | rose      |               1 |
| 10 | lily      |               1 |
| 11 | john      |               1 |
| 12 | TEST1     |               1 |
+----+-----------+-----------------+
12 rows in set (0.00 sec)

mysql> SELECT id,username,age,age BETWEEN 10 AND 30 FROM cms_user;
+----+-----------+------+-----------------------+
| id | username  | age  | age BETWEEN 10 AND 30 |
+----+-----------+------+-----------------------+
|  1 | 张三      |    1 |                     0 |
|  2 | 张三丰    |   11 |                     1 |
|  3 | 章子怡    |   23 |                     1 |
|  4 | long      |   41 |                     0 |
|  5 | ring      |   22 |                     1 |
|  6 | queen     |   77 |                     0 |
|  7 | king      |   53 |                     0 |
|  8 | blek      |   85 |                     0 |
|  9 | rose      |   19 |                     1 |
| 10 | lily      |   39 |                     0 |
| 11 | john      |   72 |                     0 |
| 12 | TEST1     |   18 |                     1 |
+----+-----------+------+-----------------------+
12 rows in set (0.04 sec)

